{
  "$schema": "https://json-schema.org/draft/2020-12/schema",
  "$id": "https://example.org/mas4mbts/vulnerability-knowledge.schema.json",
  "title": "Vulnerability Knowledge Record",
  "type": "object",
  "required": [
    "id",
    "name",
    "category",
    "description",
    "severity",
    "cwe",
    "swc",
    "owasp",
    "source"
  ],
  "properties": {
    "id": {"type": "string"},
    "name": {"type": "string"},
    "category": {"type": "string"},
    "description": {"type": "string"},
    "severity": {"type": "string"},
    "cwe": {"type": "string"},
    "swc": {"type": "string"},
    "owasp": {"type": "string"},
    "source": {"type": "object"}
  }
}
